{
  "schema_version": 1,
  "kind": "xconnect.accounts.static-client-import",
  "network_id": "network-private",
  "owner_user_id": "11111111-1111-4111-8111-111111111111",
  "source": {
    "kind": "ansible-group-vars",
    "variable": "xworkmate_bridge_distributed_vpn_clients",
    "baseline_sha256": "42001fd0d7734955c2f0d33d0f4583f96523d09dca36b3e149cec78eff795e69"
  },
  "devices": [
    {
      "device_id": "device-alpha",
      "wireguard_public_key": "AAAAAAAAAAAAAAAAAAAAAAAAAAAAAAAAAAAAAAAAAAA=",
      "addresses": ["10.77.0.10/32"],
      "tags": ["migration:static-group-vars", "team:platform"],
      "attachments": ["gateway-a", "gateway-b"]
    },
    {
      "device_id": "device-beta",
      "wireguard_public_key": "BBBBBBBBBBBBBBBBBBBBBBBBBBBBBBBBBBBBBBBBBBB=",
      "addresses": ["10.77.0.11/32"],
      "tags": ["migration:static-group-vars"],
      "attachments": ["gateway-b"]
    }
  ]
}
